<persons xmlns:xsi="http://www.w3.org/2001/XMLSchema-instance"
        xsi:noNamespaceSchemaLocation="person.xsd">
    <person>
        <firstname>Jan</firstname>
        <lastname>Hus</lastname>
        <age>25</age>
    </person>
    <person>
        <lastname>Luther</lastname>
        <firstname>Martin</firstname>
        <age>50</age>
    </person>
    <person>
        <age>40</age>
        <lastname>Calvin</lastname>
        <firstname>John</firstname>
    </person>
    <somenumbers>1 2 3 4 5</somenumbers>
</persons>
